
going louisville, kentucky tomorrow &amp; show. guess sit listen music &amp; pretend 
going meeting channing tatum tomorrow. set up. suck penis twitter! 
going move siberia wednesday.now to.siberia moved here.it's bloody freezing. #heatingtime. 
going petrolia's game tomorrow ? havent baby! 
going romney rally fairfax monday?? want go, car. help!? 
going semi-finals tomorrow going shopping lunchtime 
going try &amp; watch valor 2nd time. pretty bad ass 
going vcu tomorrow! me? :( 
going watch brooklyn nets - york knicks tonight postponed, knicks going butt-fucked miami tomorrow :( 
going watch rest x factor tomorrow tired, crying time mention take that. 
golf capsules: nick watney missed chance 59 sunday cimb classic victory, closing course.. 
gon victor cruz real deal lines outside, slot, disappear sunday 
good argument, gamble pay off, worse think constitution deadline dec 4th 
good morning, two. heard obama, un, #agenda21? traitor. 
goodnight,irene.al,you easily amused. club stinks.i think brewers upset apple cart win nl pennant. 
good time sat bedside papers poetry estella. 
good time, sat bedside. papers poetry estella 
google apps email plain slow today? 
google wallet coming metropcs, sign contract identity stolen. jokes: 
gop set bar low 4th cycle promoting grossly un-american idea: potus elected autocrat. #civics101 
gop's greatest crime? boehner proposes obama speech night nfl opening night.. 
#gotexans v. dirty #jets football team mnf tonight - 
gov. mitch daniels rallying republicans rare appearance violated 
govt loosing sleep anna hazare's fast. want gandhi figure. 
great now, 'arsenal will finish 5th' prediction wrong year! 
gregg williams find job nfl allowed back. snitchin will situation worse! 
grey bad ass endings movie 
grid till 11/7. christians driving christianity. pregnancy rape science, god's will. 
guess knicks/heat now. pretty clear tomorrow's game going happen. 
guess should've books night world book day. sat large dark room watching avengers assemble 
guys realize summerslam sunday, right?? card matches now? 
hackers defeated windows 8, readwrite mobile ranked 5th interface design, ios android. 
haha bad night barcelona bucket Oh chund!? 
haha. cant deal athens saturday. hear ignorant asses talk game. lord help 
haha! unlike scotland, bloody scorching morning, brekkie heading - later! 
hamid mom room rejected negative views saleem safi,sana bucha &amp; kamran shahid pti peace march. read tweets ! 
- happen sackings cupertino. 
happy late start tomorrow .. noo , catch day failed fucking french test 
happy valentine's day trending? ?? but.. february? 
hard find days? went 3 stores castle cover issue. none. will search tomorrow.. 
harris english drilled volunteer head 1st tee shot today. video: 
harris english, #pgatour rookie, playing started saturday plunking marshal head #ouch 
harry redknapp tells espn rumours interview blackburn tuesday wide mark: chance, playing golf! 
hate friday !! busy week :( 
hate it..saurez, ronaldo, nani, pires point bruv. 
hate themed ppv's want elimination chamber july? wait months? 
hate think it, type thing happening miami happen alabama tomorrow. 
hate watching movies friday vh1 , bet, mtv,&amp; etc. take bad language -__-. fun ! 
hate yolo..please tell living 2nd time 
hawaii moment. friday night. want home. 
hawaii monday feeling sick too. 
hear car driving slowly 24th street blarring.. elvis presley? 
heard crush going bell game tomorrow want talk? wtf? :o #weird 
heard queen good, nice guy song joongki ^^~ interested drama days unnie =.= 
hearts throbbing, 21st.. #sike! better watch world, courtney's &amp; stopping me. 
heat gunna kill knicks tomorrow 
hello there, hear stinking working class,were rioting london night, italy, bloody rif raf.hear hear 
help hoya's bias infinite :c (btw going thursday!!) 
help physics? universal gravitation. worksheet tomorrow honestly figure 
hey ego october..gary carter &amp; kirby puckett hofers you..the difference is..they class acts..which aren't!! 
hmm.. occurs received residual check year now. think email sag tomorrow. 
holger selection headache carl valeri coming injury 30 minutes tonight's game v cesena 
holy drunk! wine, johnny walker beer great combo esp thursday night emotions sadness, calling night 
homegrown talent missing signing day: throughout day wednesday, video scoreboard .. #raleigh 
honestly australia taking rugby world cup. 1st choice, talent. 
honesty best policy: fabio capello, russia coach: hoping ronaldo's injury serious play tomorrow. 
hope catch monday night football tonight, havent game yet..it's preseason wk1, feel missed lot 
hope iphone service tonite find dwts power storm. television 
hope wrong sir. welcome jacksonville tomorrow here. it. 
hoping tonite lloyd robertson will us goto window yell mad hell going take anymore! #lloyd 
horrible dream lady night..i'm tiered today friday start rodeo tonight #hearthorses 
horrible rugby world cup october? going battling bday, soul punk people running circles 
however, confirmed breaking chair duke pressbox, 2nd destruction duke sporting event. 
#howtopissagirloff stick dead goat letter box february 14th note written blood happy valentine's day 
ian going game , waste money rosedale demolish us 1st quater #fact 
I care leave school tomorrow going pissed.. 
& I danger, whip full w/deals,weapons & beyonce cd - night killed Instant Message preservation brother 
iebc hold modern &amp; credible elections, wont kenya burning intolerance witnessing continues 
iebc ready 4th march elections, electoral body used excuse delay polls chairman. 
iebc warns will revert manual voter registration bvr kits delay, poll timetable change. 
I feel kandi factory. kind cheesy? yeah. bad episode. good sunday night show. 
ignored man v Asynchronous Javascript XML itv tues, celtic v barca skys2 wed, sort yeah fuds 
I lamb god tomorrow hollyweed. punched fuckin face pit 
industrial revolution code pre-order bioshock infinite? store cant redeem. 
Instant Message going black dahlia tomorrow going stupid. 
Instant Message going halloween yet. sun shine obvious, larry bird front runner now. 
Instant Message mad catholics Instant Message going baptist church tomorrow converting #boilingmad 
Instant Message sad. shorts smell vanessa anymore:(i sat sniffing smelled wash #macandcheese 
Instant Message tired zulu 1st word pops mind 
Instant Message twitter tomorrow Tough Luck will consist bunch girls talking justin beiber #aintgottimeforthatshit 
Instant Message zan lean nun irene today band camp laugh poop ass freshman snare drummers 
interested? exclusive: td bank denies allegation aided $7-billion ponzi fraud; 2nd madoff 
interest today rugby world cup. #zero 
international committee red cross friday warned three palestinian hunger strikers risk.. 
interview kentucky fried chicken tomorrow, fuck going understand single work idek, understood interview set 
introduction literature wrote woman black, particulalry want read, cry #shitmyself 
invited. ash her. want ash ae helped mine stuff.. 
ipod kasabian much- laptop crashed time syncing empire. 10th time lucky.. 
iqaluit iqaluit without drunks screaming saturday morning .. depressing buggers. 
iranian general israel's iron dome deal missiles (keep talking finding out) 
israel's red iran: 240 [of 20% enriched uranium] // number netanyahu contest . 
it! respect you! rt boehner asks obama move speech thursday 
jack welch mort zuckerman 'wisdom'. business style mess 1st. #leansix 
jan though edd jan! feb kid &amp; coincides cny, 1 ang bao! bah! 
january jones jason wu: usually adore january's red carpet me. nude black mesh =meh 
jealous ridiculous adventure tonight sit watching big brother. 
jenelle game tomorrow.. die #missherlots #itsbeentolong #mybaby 
jenelle lies,1st &amp;the hosp.now weird keiffer's 
jonathan clary's blocked punt sets mike longo's 3-yard td laguna hills cuts dana hills lead 20-17 9:38 left 3rd 
june 9th day. going worse galaxy foams 
karthikeyan 22nd warned hrt engineer cool brakes, 53 laps go. #f1 
keith richards baby faced. *may this. 
keith richards monday night awful, cant forgive hank jr!?! 
kendrick perkins worst goatee sports. 
kevin rudd talks pm betrayal - updated: 19:00, sunday oct 28, 2012 senior labor mps batting divided .. 
khader adnan released, struggle continues. 1,600 palestinians open ended strike today mark prisoner day. 
#khader exists israeli high court will hear case khader adnan thursday. well late. protests? 
kick it. -tribe called quest answering text billy cundiff 
kill 1st episode season breakout kings? damn eye candy. 
kill me..i'm going live siberia hives time sun out.. 
kind sucks, missed classes graduation 
kind want stay cry day tomorrow.. 
knew adidas deal! it? undecided.. watching game sat? trying off! 
knickers ready I city tomorrow loads shopping fit monday.. #shopping #norwich #addicted 
knicks/heat game tomorrow night bibleball? well play watch day! 
knicks tonight, upset tweeted it, shits real shaking head tomorrow night, knicks/heat 
knicks vs nets game moved way 26th damn 
knicks vs. pacers 2nd round association mode. upset #1 bulls 
know, fish tank &amp; guy named jeff carter. sadly, think dying 
kobe 4th eli manning. #beware 
krul crocked, putting craig gordon britains 2nd expensive keeper without club? #nufc #safc #ftm 
krul injured newcastle rob elliot will start goal? bench season 3rd choice. #cafc 
kurt drugged rohypnol, root beer scene. incapacitated, murderer 
lack communication #nycdoe frustrating reporting time work tomorrow. thank #uft info 
lady gaga fears classmates: los angeles, nov 1 (ians) singer lady gaga touch pe.. 
lady gaga fears classmates: los angeles, nov 1 (ians) singer lady gaga touch people h.. 
laker fans take sign beat sacramento kings twice preaseason..and starters played 4th 
lakers vs heat jan. 17th! wade's day.. feel bad lose birthday lololol 
late crap sherlock thing, honestly foggiest central library extreme droll 
laugh death!!lol!! trust translation google anymore! full errors!! way played truant today .\_/.! 
laughing ass rt curtis painter kind guy try buy beer sunday. #scumbag 
laughing ass sat minutes fuck courtney?? ha damn.. -__- 
laughing fucking ass big ass nerves, going class tomorrow? 
laughing fucking ass , die . niggas nca tomorrow 
league? rt barcelona real madrid playing sunday.. sleeping pills.. 
left side weakness, 1st game young injury evra.. well evra evra. 
lewis 5th burning effigies guy fawkes, pope &amp; whoever presently dislike. sussexy indeed.. 
lhh girl .. cool. uhm want tennessee state . want roommate .dont want chance . wbu? 
lin picks loose ball trucks stuckey. unfortunately, allowed, bench 4th foul pistons reclaim lead, 67-65. 
lions brilliant film think bit insensitive channel close 9/11.. 
listed star attraction aust-china event today. rudd's office committed, pr charge cancelled friday. 
listening amy lucien's attempts 'communication' night's big brother .. fear future mankind sometimes. 
listening capellas 2nd law appreciating bad ass bellamy is. albums 
liz kind dumb men. dna swapping bad port charles, called tuesday. #gh 
lloyd robertson's broadcast tonight! era. going grandma company night!? 
lmfaoasdfghjklomg. picture jenelle 1st day school 5th grade.. damn nigga changed. 
#loanwatch: ben amos doubt tonight's hull city game vs doncaster (2nd round league cup), groin problem. 
long day work, g37 meet, marijuana march avengers. sick nonetheless. 
lorax stupidest animated movies sat through. wasted nap this? 
lorenzo beasley. killed july 17th year corner 53rd king dr. ~#mile 5 
losing week, today gop trying win senate seats wisconsin recalling democrats. fail 
lost interest bioshock infinite delays etc. think drawn bit: 
lost respect #annahazare minute sat duratma gandhi's graveyard yesterday. india gandhi. vandemataram 
lost screenshot shirt, going wear screenshot jacket tomorrow ;b 
love #knicks good center 1st time ewing &amp; sudden rid allstar voting position 
lower rank mcgeezers will league 
lpg price hike hold: facing stiff opposition, centre thursday night hold rs. 26.50 incr.. 
lucas scott, c'mon! why'd die hair!? 
luna taking break today, perfecting major aspects 6 planets, will meet jupiter tomorrow morning 
macdougall killing raiders. mad dog scores 2nd good leadup work gidley houston. gidley misses kick. knights 16-4 
machine gun kelly concert 30th!! &amp; shut bitch down! 
madison wipe black lines !! ash wednesday, wipe shit off. 
maidana fought khan fight? hahahaha lost devon alexander february shit also! #clueless 
mail monday First Person Shooter russia tease laughing loud 
mail sunday: cesc fabregas desperate leave arsenal barcelona offered .. 
maino thinks going hour tomorrow.. going! i. don't. give. a. fuck! 
mama going jacksonville saturday ,i want ,i'm punishment .! 
man, death mr.mitch lucker. rest peace. 
man,i want fuxs homies tonite mnf #horn can't:( 
man thinking hard 12 inch penis saturday morning pee bad race horse kentucky derby 
marana girls bad fuck white party went jaylon saturday marana tigers. 
marathon happen, ignoring saturday's nets game on, find article deceptive 
march 3rd 2010 -do think kevin rudd superficial? yes 85.3%(6513 votes) 14.7%(1122 votes) rudd revealed failure #auspol 
mark martin unluckiest nascar driver time, 2nd 5 times points &amp; heartbreaking 07 daytona 500. 
martin atkinson man middle sunday. #nufc won game charge. 6 losses draws 
martin atkinson referee tomorrow. remember, missed balotelli's shocking tackle song. 
martin leader 2nd unit harden. guys bench westbrook ball hog 
martin stupid 1st notice, 2nd notice, catch ass street notice 
max tomorrow &lt;/3 absolutely heart breaking puppy go. love maxy x 
-may- girl face earth find channing tatum attractive. #callmecrazy #justsayin #donthateme 
meant going roundhouse, decided tonight want anymore, going apply joseph wright tomorrow 
megavideo bitch tonight. understand it. ugh. want watch episode merlin, kay 
men's latest bedroom worry: '50 shades': james' 'fifty shades grey' supercharging sex-drives o.. 
men tomorrow will hardest patrols..cif turn hope 
mere mention catholics blood rise - raised catholic. rejected 5th grade. 
merlin! 3am busy day today. kill now. 
merril hoge stupid. sick hearing tebow do. #1 took aaron rodgers 3 years start 
mess coming towards us tomorrow. spc slight risk tomorrow, it.. 
met perfect piss mexico city it!!?? #tottenham 
met players 1st time: affirmative johnson fella walks owns place. debagged &amp; flicked helmet! 
mexican! late answer, ipad' charging fucked yesterday :d 
mexico city.. will fail subjects going school week. rih mexico 14th. omg.. 
mfs blastin rella hood saturday shit laugh loud shaking head 
michael heard green day's 'time life' 1st time leaving florida burst tears. miss.. penderg 
migraine saturday &amp; blood vessel burst yesterday eye located. rocking marie colvin eyepatch 
mind me? 1st think max sad think dies 
missed :(( cutie remind watch stevie television sunday. dying. 
missed today national margarita day?!?!? kind ash wednesday.. 
missing hooters,my husband,my life,my photoshoot tomorrow,guess going drink bottle wine xanax pass fuck out. #bye 
misunderstanding called whom. bigger issue pepper-spraying people want march republic day 
mizzou links, 9-5-12: holy smokes, wednesday already? posted bill carter's sela photo gallery.. 
mncim, rain stopped saturday's game wasted time waitse! ss4 playing better tonight. 
mommy leaving sunday. shit. knew leavin, when. 
mommy maxwell monday , lmfaoo fuck 
mom sat playstation netwok went down. 
monday morning caltrain ride work short. minority opinion. #fb 
monta ellis commits 1st foul! cold missed fts, foul start q3. #bucks trail #bulls 70-60, mid q3. 
move today. mta sexy though. whippington needed 
mr.craig sunday night officially day marching band. &lt; &lt; 
mta cost night. think waited 45 minutes. pretty freaking hot underground. thanks. #nycproblems. 
mta pretty embarrassed tonight. 
murray dallas cowboys felix questionable atlanta game. good running backs! 
mvc teleconference, jacobson lot things wrong saturday's exhibition tape. #unihoops 
nabasa aq! I Instant Message going :/ ang sabe dito nasa hell daw si pope john paul ii &gt;:| .. 
naruto tomorrow khr, bleach, op. negatives outweigh positives. 
national kissing day thursday! tf shit up??! 
#nba brooklyn nets opener vs. york knicks postponed. originally scheduled thursday evening. 
nca football coach lessons pr 101. #1 matters worse trying intimidate media. 
nebraska land gesell..a top 100 guy state him. c'mon #nebrasketball 
neighbor removing trees 7 year bothered day school.we lay lorax bit 
netanyahu's alliance lieberman automatic win election. 
#new #shit 10 things friday: u.s. postal service, brink default second.. #new #swag 
news, marijuana march #toronto today: hear 'em coming, smell them. nice..not. 
news release 09 october 2012 customers negros sub-grid experienced partial outage today 5:45pm (cont) 
news: sydney, oct 12 (ani): pacer james anderson attacked arrogant michael clarke batsman's pad dressing room afte.. 
nfl commissioner affirmative goodell cancel professional bowl: care professional bowl? 
ni**as paris encore, mosh pits, b, 2nd pit failed b's security! 
nice? bored today. list 395 applications ready windows 7. tedious 
nick diaz fight pussy tomorrow ufc asked . except, know, wouldn't.. suspended.. 
nigga hit full court handed shot brook lopez..smh, 21st birthday shit 
niggas 10th grade shit tonight 
niggas 7th grade fights high school deal. 
niggas boutta droppin flies georgetown tomorrow , wont catchh ! 
niggas fighting gas station sat night though 
niggas going die december 26th foams .. laughing loud rs .. niggas going rob &amp; da shoes yeah life nigga laughing loud 
niggas lakers dick..we gon finish damn seed..while year team struggling 8th spot 
niggas version taylor allderdice. 3rd track want turn shit 
nigga tt! rt #nigerianewspaperheadlines terry releases 1st rock song nigeria --apako 
night lloyd robertson. sad day news, will deep voice. #legendary 
nightmare night missed 2nd #fantasybasketball draft autodrafted jr smith. #truestory laughing loud 
nikki walker will rugby world cup account knee injury sustained yesterday v italy. details 
nobel peace laureate jose ramos-horta warned monday syria risked somalia voiced pessim .. 
noel gallagher: musicians fucking idiots. - yeah, brian - idiot.. idiot professor? 
'no favorites' russia-portugal clash - capello: moscow, october 11 (ria novosti) - russia's match portu.. 
#nofucksgivinfebruary shit anything, pose problem valentines though 
noo delayed knicks nets game monday! 
noo rosanne! restocked going overseas sunday afford :'( 
noo!! test tomorrow 
noticed huddlestone haters conspicuous absence yesterday, assisted bale 1st goal #thfc 
noticed using spanish abbreviation , no? think missing rafa, mon brave 
nurgh, stack mta's dealt dealing crappy thing today d: 
obama's goal lead us 3rd world status, absolutely right, obama care 
obama weak 14th ammendment knew congress block it. 
obma fails 2unite us, divides us sex, color,party,age, wealth nevada's 1st latino governor votes early romney, predicts gop win 
obviously, fan dream high watched it! well, watched 1st ep,that's heard song!^^ 
october 25 2011 told taylor swift listen wrote else. year still. 
oct. wait return #dexter! 
odd man buzz kendrick lamar. decent guess, stellar. 
odds timmonsville's town council meeting today? met tuesday, overdue. #tville 
officialy hate windows 7, sucks laptop. experience tomorrow! (and huge delay movie :/, close!) 
oiler fans unhappy with, 45 points season, gagner 2nd c. habs fans hate 28 point eller 2c. 
o. johnson commits 3rd foul! cold bench 3 fouls turnover q4. #pacers losing 98-87, 4:52 left. 
okc thunder center kendrick perkins preseason wrist injury 
ok.. going melaka tomorrow morning, two others.. visiting friend icu. :( 
olive garden's dinner today &amp; dinner tomorrow special, person thinks hey, terrible! wonder microwaved? 
ooh. haha. well unfortunately watch tonight. might. it'd blue will 
o_o well, (un)fortunately, problem london late oct.! 
open link, ferry corsten december? 
open source misconceptions fading: web: south africa years rest world .. 
oslo gloomy whole day. temperature non-sunny outlook. hope better tomorrow. 
others..jenelle mistakes time change better person..its late you..fuckhead 
#pakistan#news procter gamble sales fall 6.7 %: p&amp;g net earnings quarter september 30 fell to.. 
parker, leonard steal okc's thunder: minutes tipoff thursday night at&amp;t center, oklahoma ci.. 
party. guys playing refuse play ground war. open lobby wed. 
pee russian race horse kentucky derby saturday truck 
people caltrain 4th king #sfgiants parade pretty wasted.. drive guess. 
people lying direction 4th album, lied direction unbroken? 
people marched london months. care 1,00 tottenhams tonight ~ 
people mick jagger is..you old, school c'mon! mick jagger lot years you! 
people noel fielding tomorrow, extremely jealous you. 
people talkin shit wait huntsville tomorrow !! !! 
perseverance instances. #occupyauc equivalent 25 jan revolution. diff? 
peyton manning .. noo!! curtis painter starting sunday, going lose shit. 
physics revision tomorrow merr, going fail 
physics tomorrow going shit 
picture 9pm, rural nebraska truckstop, snow flurries, february, starving. food options food court. yikes. 
piece candy injected something. #why 
pimple size jupiter's 12th moon forehead! fml! 
pisseedd missed kid cudi's dallas, trending worldwide night, &all Instant Message hearing positive reviews lolla 
piss russian race horse kentucky derby glue trust stuck ahead 4th place 
pist volleyball game tomorrow 
plant city staples friday nights. 
play born tomorrow screenshot will throw mouldy donuts flat bellamy shitey roulette wheel 
playing jacinto gears3 guardian 1st time raining wth.. 
play temple run, watch himym season 8, orr..to sleep readiness tomorrow's morning interview - decisions hard make!:( 
point, flacco 0.3 qbr sunday. vet qb bad day. 
police fear ivan leach, lee cyrus carried serious sexual assault tayside, scotland, absconded oct 9 
police, protesters clash republic day march turkey: day marking 89th anniversary founding .. 
poor bruce springsteen: 1st swan co-opts badlands; abbott adopts wrecking ball title. will aussie politicians leave alone? 
post night: anonymous (id: excv6jkr) 11/02/12(fri)00:52:39 no.434329650 thread watching monkey fuck coconut 
pottstown game 19th..get together davie 
pottstown halloween. borough hall phone order. nearby limerick, pa fri. 
power point That's want today, changed language. #friday #tokadventures 
prayers thoughts pavol demitra's family today plane. blues nation lost loved member today 
pray hurt killed london tonight guys. going hours. 
predicted winter classic all-star game will cancelled upcoming monday .. fuck !! #endthelockout 
prediction machine loves kc +8.5 tonight. kermit fucked thursday. went w sd.. going lose works. 
premier league team ready tomorrow. bit risky tactic backfire week 1! ready nfl friendly fire draft tonight 
pretty smarty pants lawyer christianity christmas matter. 25th. #dumbass 
pretty upset going jets practice tomorrow /: 
price laid fraundley harrison pretty bad easily, klitschko brother wipe floor him. #boxing 
prince william met 'the rottweiler' camilla parker bowles ..: harry full mischief, a.. 
problem! boy best rim tomorrow laughing loud going rim.. laughing loud want school.. 
problem minute. shotton awful tuesday. 
professional bowl definitely better national basketball association all-star game trash 4th qtr 
protest march mexico city drug war. 'i want justice murdered son' #drugs #cannabis 
protest mitch daniels purdue presidential nomination tomorrow loeb theater 2:30 pm. bring friend! #soapurdue 
ps sat affirmative johnson restaurant upped drug abuse crack judging #wwfc #dohertyindisguise 
pull kentucky derby picture 9th grade. #blackmail 
pushed ss4 ben sheppard. worse. thursday night colin murray #afc 
push sunday, will weeks playing cup game midweek nufc. .. 
qb printers didnt start. wr avery starts scores 1st poss. 27-31 wichita wild 
queen madonna bitch #gogaga 
racism, threats, &amp; hatred toward entire zimmerman family racism george had? #hypocrites 
radio instead. mt week without waterloo road. going boring thursday. 
rafa injury best year 1st race.. :( #m6 
ramdev's jailed aide's picture freedom fighters ramlila: delhi, aug 9: controversy erupted the.. #india 
random rant night:lady gaga considered fashion icon!who mind considers fashion?she dresses trash. 
rate lee dickson danny care bench sat 2nd test 60 minutes tired legs will dangerous #rugby #saeng 
rdm seriously believes night proves sunday's defeat unjust? anything, surprised xi vagina sunday. 
reading sun watching jeremy kyle. wrong? better work. #ashamed 
read timmonsville beating crap mcbee 60-8 3rd!! 
realize bellamy freshman qb play selection leaves lot desired, option toss 3rd 7 #cmonman 
realized spent halloween, super bowl sunday, two birthdays library, computer lab.. 
realize voice rigged. cassadee pope sang signed band hey monday. dia half meg &amp; dia. 
really? really? terry's guilt well proven, television footage available. suarez punished strength evra's word. c'mon! 
real madrid coach jose mourinho faces selection dilemmas ahead sunday's la liga trip real mallorca, sami khedi.. #fb 
real shit ray allen meeting knicks tomorrow 
reason swap, ios daft games. android desolate wasteland games. 
reckon 6 years time chance fucking pixie lott bump night out. rohypnol required. 
recommend turning waiting verlander tomorrow. 
red cross halts pakistan aid beheading: international committee red cross tuesday.. 
red cross: syria conflict civil war: international committee red cross sunday 
red eye flight sat. night 1am send tell layover dallas cst clocks pushed hour. 
