
1/2 white? does'nt matter;malcolm x well.still specifics.u people ideas bombs killem 
1:30 morning want watch vampire diaries. sad. 
13th. android device worth buying nexus line, opinion. galaxy 
14th hindu tn edition :(. gadkari though. media will day sell india bread crumbs thown dynasty 
17th anniversary rabin assassination, netanyahu calls murder 'one worst crimes age' 
19th journo murdered somalia / tokyo 2020 unveils stadium design rivals/ madrid 2020 olympics / 
1st 10, ball wsh 34-yd line. griffin pass, looks, moves around-here justin tuck rg3 :/ 
1st 5-star review. colour lemon sets bullet train gruesome murder sowerbutt's own. 
1st free.edom taken away. cant buy size soft drinks. 2nd.religious freedom catholics. next? obama..coming 
1st halloween kids trick treating.. kind sad i.. 
1st male friend london send ping!! ping annoying, 1st good friend bet ping?? angry 
1st second contact nyse delay (7/2010) mark donohue. guy botched early madoff inquiry. 
1st time bring phone harold washington &amp; off! :/ 
1st time juventus maximizing potentials ex-milan players..cannavaro edgar davids cases 
1st world theres good evil! real people fake mf's!this feel jlin it!not durable yao ming! 
21 room noel gallagher, shaun ryder, bez preston sat kfc. brilliant. 
27 hours Instant Message going boys live 1st!! Oh gosh girl Instant Message So scared tomorrow! 
2nd coming: will blacks america debate 2012 election #bet tired hearing people potus blks 
2nd dangerous beach world gansbaai, south africa world great white territory. a.. 
2nd game united lost chelsea. martin atkinson decisions incurred wrath saf. 
2nd night parker ..boy boy 
2nd zen dixie! read &amp; share, god will kill baby kitten. will haunt redundancies &amp; bad puns. 
30-mile bike ride giants weds caltrain going suck cardinals. 
3 episodes 10th time. want bootfuck phil &amp; johnny sac time talk. 
3 grown adult males watching kung fuck panda 2. 2nd thought awkward hk, land murses 
3 people life going hawaii friday without 
3rd dropped afghans. pressure. #indvafg #wt20 
3rd goal 1 rivers throws int. terrible pass rivers . bad decisions cost games. geez half time suck dick 10-3 
3rd grade stole valentine day cards crossed passed out. 
:'( 3rd hospital file working me. try download fun 
3rd mariah song night noo. bad. #xfactor 
3 years left deal afc's resistance strong. predict espanyol will finish? 
4th album way tour unbroken.. :( #australiawantsdemi - starting think coming 
4th floor cypress half funny dress sense #spanish 
5 minutes candy dancer deja vu nutting 4th pump bad laughing loud 
60 mile cycle ride today. sat seat long ass feels spiked rohypnol redneck #ouch 
6th straight 1st round submission 6th straight 1st minute ko, miesha tate 4:00+ her. right! 
aaron carter coming 4th album carter iv 
abc: ricky ponting luke butterworth wednesday tough day office south australia sh.. 
absolutely gutted. wish watch rt lloyd robertson set 41year national news anchor tonight 
absolutely smashed. early tomorrow strawberry Stop That james' park. fuck mackems 
acta ax. wrote managers hot seat tuesday 
acta choo thrown 1 9th. tying chance plate. 
activists demand release jharkhand tribal leader: delhi, nov 1 (ians) condemning arrest woman trib.. 
actually, omit vaccines top 10 move kasabian 9th, enemy dropping 10th. told it. 
addicted temple worst thing happened haha. 
afford 4th. carter iv great, failure 
afghans protest french cartoons, us film: hundreds afghans thursday protested time a.. 
ages kfc, well apart mush bun passed breakfast sunday, count though 
ahh song joongki.. 3rd place ?? *sobs* 
akin murdoch scum, rape jokes better brah. (cont) 
alabama huge commit today upset sheridan admitting nothing. 
alright, daughter singing avril annoy me, forced retaliate. 
also, check arsed updates sunday. hears news, pass me. thanks! 
amanda thinks going oscars valid excuse washing hair thursday. 
'america's talent' semifinals tuesday: want singers american idol x factor, said.. 
amsterdam early friday morning ideal, want home! 
anderson silva doesnt win tonight yushin okami wont brazil alive 
andrew breitbart well murdered? 
andy carroll header? technique! c'mon! technique. technique passing ball 5 yards 50 times. 
annoying pre-ordered today..steve jobs looted card. 
anyway, random tweets finder. unfollow night. normal sports stuff tomorrow 
apple ceo apologizes error-ridden map app: apple ceo tim cook apologized friday company's error-ridden mobile map.. 
apple ceo 'extremely sorry' problems maps: source: -- sunday, september 30,.. 
apple innovate manage supply chain: cupertino, - october 04: apple ceo tim cook speaks event introducing i.. 
appleland, steve jobs spit morning coffee computer screen. eah! 
april fool's day? real madrid signs 7-year-old argentine prospect leo - espn 
arrived scotland yesterday hasnt stopped raining since. things worse sunny home. #typical 
arrogant! 1st debate knowing leading polls prepare! romney potus. 
arsed work tomorrow! #boring #blag 
art think New York City host marathon sunday?..why So desperately help,where respect 
ash wednesday hard me, day focused ash body brings bad memories me. 
ass hole woops bad play knicks tomorrow 
assuming heb candy people decided pizza busier super bowl sunday today 
aston villa joke mate profile picture want hit gym head bridge w bitch slaps #jogon 
aston villa win game knickers ready I city tomorrow lunchtime. win - mighty fallen. 
ate mcdonald's feel guilty going 24 hour 2, az tomorrow, try life better 
attn: runway class tonight nov 1st cancelled. inconvenience. will rescheduled next.. 
.at_user amanda knox lied repeatedly & cleaned bleach morning innocent petal 
.at_user sat sanchez nou camp wycombe game. laughed taking the.. 
august 11th 2010 day met mitch.. regret taking picture him. fuck. going screenshot shows.. &lt;/3 
austin rivers 1st game people sucking rookie chill ! 
austin rivers overrated 1st round 
austin rivers stronger, #spurs guards muscling tonight. started scored 4th. #hornets 
australian directioners heart attack. news boys oct/nov :-( #nottrue ? x 
aw hell curtis painter coming 3rd 18 conversion. 
aww :/ Instant Message pissed cant download unbroken youtube sigh, Instant Message going cinema tomorrow :d 
aww shit amsterdam fridge. mmhmm tomorrow work I 
axl rose trending worldwide sat butt chair talk live television drink water mug. bow down, peasants. 
axl rose up. now. later, soon, tomorrow. now! 
badly judged joke herring. joke rape reference rohypnol evocative such, matter intent. 
bad mort zuckerman 1st amendment nydn website evil 
bad news, gibbs saturday. unless play tv5 lb, lost started. santos liability will cut shreds 
bad rodgers Go air 1stq! hope tomorrow good too, tony romo #spellcheckjoke 
bad thing barack obama 2nd term president flop 2nd time round historically 
bad times missed waterloo road thursday tenerife realise episode :( #notfair 
bale doesnt celebrate goal races cuddling dempsey 2nd. illustrates perfectly bullshitting spotlight whores are. 
balls. forgot celebrity juice tonight. 
ball shit broken ankle sunday football army 1year thanks callum twat 
barack obama cared people Nice job lift union ban george bush 3days katrina. #sandy #october failed leadership 
bathroom want ship dempsey deal? 6th choice minute ll, ja, sg, ns, jj. will take cole co? 
bca school tomorrow..not feel that.. 
bear power crisis: jayalalithaa: chief minister jayalalithaa wednesday asked people tamil.. 
beautiful night throw brooklyn bridge --at_user 
benson's attention, frankie feels forgotten stepchild. 'founding father' will forget 2nd place. 
best friend arrived New York City australia. damn it, watch two-hour opener terra nova tonight. 
bestfriend,octaveia, cousin ,april .. bestie,kaliyah, tricey, dasia,mikia,&amp; people richwood !! 
betrayed wife legally allowed kill adulterous husband, bare hands. (hong kong) 
better take joe pa pet semetary.. win agdin 
beyonce sound. call hating, real. 
bharatiya janata party (bjp) national vice-president gopinath munde sunday refuted rumours going join congress. 
big bang tomorrow, day way soon! live sat.night!! ^_^ 
big brother starts tonight x factor saturday, wish emigrate hibernate :-( 
big mix people, channing tatum here, anthonee bercik, autographs tomorrow. 
big strictly gunplay church pistol whip priest sunday. damn :| 
big time rush considered kiddie band talent care fans! 
bill, murdoch apologize changed view matter. 
billy cundiff. missed fucking gay 2nd quarter changed game. play 
birthday february. friends think valentine's day so. :( 
birthday tomorrow spend natchitoches family&lt;&lt;&lt;&lt;&lt;&lt;&lt;&lt;&lt;&lt;&lt;&lt;&lt;&lt;&lt; 
bitch frog laughing fucking ass throw thursday 
bit frustrating. think playstation netwok account. tomorrow. 
bjp drama hide facts, minister - government tuesday accused bharatiya janata party (bjp) of..url 
bjp members walk jpc meeting 2g: bharatiya janata party (bjp) members tuesday walked p.. 
bkk sleep game. 1st time lost ref. 
blaming rafa season finished 7th ignoring negative impact cecil h&amp;g! 
blow lions..joel patfull's season breaking hand sunday's loss adelaide. surgery wed morn. #afl 
body exhausted. walked 79th jeffery lakefront, accidentally sat dead fish, 55th king dr. back. 
boehner tells obama sorry, house booked sept 7, day.. 
boehner wants president change speech thurs going #gop2012 debate. what? time packers-saints #nfl opener?!? 
:( bolton today weekend. typical timing ever! 
bored host super sunday talk rave man utd #biasprick 
born february close valentines. heart pains love guess I'm going crazy 
botching case lieberman, israel's ag way union netanyahu 
bought 1st heineken beer las vegas. ps lived 5 years ~what took long! 
bought tickets sat's nets game prices jumpd allowd seller reneg proof tickets #poorcustomerservice 
bought touch crap sherlock tomorrow. frame mind #leaveityeah 
boys: calvin watkins explains sunday night games bad luck cowboys and.. 
brad playing hurt today too. 9am espn 
braiding hair tomorrow I care good taking 
brain fried .. turn .. feels ground hog day .. shock treatments reboot!! 
breakout kings went downhill killed black dude ep 2nd season. 
brick$quad yankees 8th period english ii doc caputo. #targetonourbacks #hatedbyall #champions 
brits punishing us american releases late pond. #skyfall november 9th. #damnyou 
brits us-style debates. debate wednesday. again, uk parties work together. usually #pmq 
brother nigga zimmerman charge 2nd degree murder. kill 1st time? laughing loud 
brownsville bad depressing. wait tomorrow. 
brr shock am! +2c windy feels chilly sun :) colder siberia tabs.. 
bruno mars song wicked. sounds cross police michael jackson. play 14 times/day..! 
brutal loss gets. 6-0 outs 9th blow it. going long winter wsh. 
buffalo bills' kyle williams misses practice thursday: second straight day, buffalo bills.. #bills #nfl 
bulls season tips wednesday night vs sacramento kings. excited word. frustrated one.. 
buses white hart lane &amp; high road n17 area subject diversion &amp; delays tottenham hotspur match 
buy arolladora tickets? pico rivera? 14th?? wss sold out:( 
call 'good girl' time find scolding hot coffee heading towards crotchal region. 
caltrain catch break. mt 10:30 a.m. train #425 struck female train tracks south 16th street 
canceled frankie supposed tomorrow. going rescheduled south bend. 
candy till monday. (by stupidity) sick person meow. .-. 
capello bemoans language barrier russia: russia coach fabio capello spoke monday frustration la.. 
care carling cup! save #looserpool! yeah lose wont crying night long wednesday night! 
care kids future? think it: education 1st thing cut budgets level. 
careless world tour hit 8 places cali. haha fuck, yoo. 
case forgot panthers horrible defense. pathetic. ranked 27th top (gamble) injury. #cowboys 
castle sun. staying tues. mother aint safe dere york sandy dere fuck you, sandy. 
catch eating meatballs friday lent, care. 
caught repeat jersey shore tonight damn wall knocked wtf.. Come bro! serious 
cena wins undisputed World Wrestling Entertainment championship match summerslam sun? riot take place!! 
centre social justice report gangs - year riots. #d policy exacerbated problems. 
centre suffering 'policy paralysis', alleges jayalalithaa: jayalalithaa tuesday charged upa go.. #news 
centre suffering 'policy paralysis', alleges jayalalithaa: jayalalithaa tuesday charged upa governme.. 
chance post day. goodbye ralph mcquarrie. return force ghost guide young artists.. #starwars 
change yesterday. day, hope toward tomorrow. (anonymous) 
channel 7 weather going tomorrow taylor swift singing.. #eeww #getoffmytv 
channel celebrating 30th anniversary? pretending 20 years fucking good happened? 
chapel hill tomorrow #usps contacted damn speech processors!! hate #usps 
cheap shot scumbag, bit fuck todd bertuzzi 
check video -- obama, sarkozy, cameron, children kill night? via 
cherry moon, niggas carry heat, bury june shaataap 
chesters tomorrow match shoddy cool motherfucker? 
chill. wait unleash aggression black dahlia murder tomorrow. #gonnaendalife 
cif piece meant funny? mean, unintentional sense ironically humourless 
cliff avril leaves detroit lions game injury: detroit lions defensive cliff avril left sunday's ga.. 
cliff avril leaves detroit lions game injury: detroit lions defensive cliff avril left sunday's game.. 
cliff avril leaves detroit lions game injury: detroit lions defensive cliff avril left sunday's game minnes.. 
c'mon guys please, want diablo ii did.. :.( 
c'mon leo endymion.. amsterdam likes amsterdam. songs shit compared 
c'mon.. play winans!! 
c'mon rebels, apple pigs mouth!! red wolves fans focus hate &amp; anger pigs tomorrow. 
cofield hopped deathmatch sticks 3rd year. niggas tired laughing loud 
coloccini likened bobby moore, will hate mon claiming mcclean johnson 'class' #safc #nufc 
coming nz tonight tomorrow morning?? waa Instant Message confused ): 
commentator references smart dook players are, turn mess off. #overratededucation #dook 
complete crap. began sadat peace. bye bye wants use military free. &lt; c'mon 
completely, utterly lost.. viable 2nd option, knew parker's shot! 
computer fans saturday. stuff 'she no' chant. bollocks. ball, turn him. 
congratulations idiots rioting nth london tonight - suppose education protests #singlecell 
congress lashes bjp coal block issue: lashing bharatiya janata party wednesday its.. 
continents challenge filmed on? 21? okay, fail 2nd grade? 
convinced haye v chisora fight upton park saturday..personally carlton cole v emile heskey 
cool miesha tate, bantam weight champ card. c'mon #strikeforce treat better. #rouseykaufman 
correction marching band cancelled tomorrow, world think common sense cancel school early duh! 
costa concordia accident: ship's owners captain committed errors - breaking news buzz 
count day tomorrow shouldnt ! winans crazy -_- 
countries playing, 6th seeds. missing ched evans, bellamy, ramsey, collins etc! 
crap meant #oomf use microsoft office thing computer today..well weekend town! 
crazy. jealous going joe pa's grave! sad saturday walked statue be:( 
cried dead badger named shreddie animal planet. tough friday night. 
criticism rick perry ridiculous, choice? obama's hip-hop barbecue two days ago, perry praying president today? 
cry listen avril singing tomorrow dublin,i remember bad happened :/ 
cupid work 1st time want friend 
curtis painter's finally going shot tonight. help root guy! 
daily digit: exchanges lost $1 mln day: oct 31 - nyse, nasdaq, cboe lost $1 trad.. 
damn, cougar town cupcakes going bring tomorrow share. *shouldn't* eat 12 alone.. 
damn drexel penn canceled classes monday tuesday hurricane. 
damn saturday tho niggas trynna shit #early 
damn, saved holder earthquake! technically w/biden & obama boehner 3rd line! 
damn wait til' tomorrow oslo sis. damn. good waiting 
damn want computer. tomorrow :( harry feels control outtakes video broke 
damn work chance call martin poems. tomorrow 
dana two false starts called trying punt, 3rd returned 18. laguna hills scores 30 second left, 31-27 
dang, forrest done. :/ american hope tonight, well.. main event anderson silva vs yushin okami 
danica patrick temper best sunday knocked nascar race 
danny care best scrum half england massive c-bomb 
david guetta's playing alesso fort canning 8th oct. want hear alesso leh. 
david miliband oxford bad grades? #bbcnews 
day &amp; tomorrow. #wtf #pt 
day bca tomorrow. -lori yes dress breast cancer. :( 
day soon, sun going shine. she..couldn't wrong! valentine. 
days , relatives gather 7th uncle house celebrate chinese year , guess happen 
dead americans #benghazi lesser tragedy death trayvon martin rip. 
dead point. expect sweep verlander pitching..now lucky tomorrow, gravy huge. 
dear spurs, coc, champions league wont top 4. exist? 
debate twilight night? team edward?? 
decided watch notebook time midnight thursday me, crying 
definitely hype knicks nets game tonight &amp; brooklyn 1st fuck #hurricanesandy 
dematha shocked gonzaga saturday. stags regroup time wcac playoffs? #mdpreps 
democrats spent night morning trying talk stock market..whatever blank check! 
democrats will implode concede. obama will veto boehner bill invoke 14th amend..then impeach! 
depending sensibilities, unofficially progressive derivative. bad leads supply heat needed. 
derby tonight :'( man though bad =] 
desean jackson suppose training camp monday..hope eagles lock extend mike vick.. 
deserve death penalty la todd bertuzzi, think 3-5 games fair, whole 1st rd. 
desperation day (february 13th) well day mens life. 
dirt poor kids 3rd world countries manage money kids valley can't? 
dirty bombs sunday will launched mark dirty sanchez jets pummel romo's homos #terror #nyj #wtc 
disappointed knicks vs nets game canceled tonight, hyped knicks vs heat friday! 
disappointed movie ghost rider: spirit vengeance. better 1st ghost rider movie 
disappointing uk govt issueing reassuring messages tehran influenced :) 
displeased lion, take opportunity learn windows 7. linux. poke eye. 
distin's derby disappointment: sylvain distin voiced frustration taking point sunday's mersey.. 
. dmdk party led actor vijayakanth sustain long time shrewd politics jayalalithaa. 
doctor ambien election night. sleep hope wake footage mitt crying loss. 
doesnt sony promote 1st party games? ac3 commercials television time. (cont) 
dongwoo's fansite accepting members now..need register 11th 
don't! fit tomb raider costume wednesday! save #cakecrawl! 
dope night eagles .did #sangz1 tell deleted pictures 
drexel classes cancelled monday tuesday..now work cancelled.. 
drive ms. pope saturday.. kill now. 
dr jan radio 2ue tonight david oldfield reply kevin rudd's sad loss family cat. pets deserve honouring love unconditionally. 
droid bionic pops motorola site, set september 8 release: leaked ads, blurry photos .. 
dry, liquidambar dropping leaves. threatening rain, shower.by contrast scotland 4 tomorrow 
dtn usa: charlie sheen's 'winning' ways roasted: looked winning, actor c.. 
dual policy lpg pricing acceptable public, suggestion govt. rationalize price upto rs. 600/- 
dude.. dook football, sun shines dog's ass days. #unc 
dude jerusalem take test thursday holloween wednesday&amp;he's going hang #purehonesty 
dumb asses decided shutdown main Stop That friday town 50,00+ strawberry festival 
#earthquake thing history mta caused service disruptions.. 
east:( though..moon, jupiter, capella light evening sky november 1 | tonight | earthsky 
echo: sex offender warned face jail offences #dorset 
ecuador worried assange's health - ecuador concerned health wikileaks founder, jul.. 
elon university rip_chords concert saturday..you're sinning. 
embarrassing. rams cut alexander. yes mizzou. c'mon. chiefs unknowns professional bowlers. 
emmanuel adebayor held heart-2-heart talks tottenham manager andre villas-boas unhappiness lack 1st-team football. 
episode #friends tonight. leaving e4 comedy central :'( I will cheer Instant Message 
ep kings going play super rugby playing kwi 1st div.. crusaders aint puma's 
esperance will without star player youssef msakni leg champions league final al ahly saturday. #africa 
everybody's warning better piss tomorrow, I care going snap #done #imatmybreakingpoint #canttakethisanymore 
evil laugh 3rd grader reads short story, times, mistakes becky blocky? #stickingtoit 
evra upto. buttner. games.rafael defend. buy jan 
eww lady gaga femme fatale tour tonight. surprised gaga using britney's props tour laughing loud 
experiencing issues fuel television (ch 39). friday monday. 
extra point good. screw 28, morgan state 20 5:02 left 3rd quarter. 
eyeshadow smeared center forehead. participant ash wed. pulled chunks eyelashes :/ #fuck 
fabio capello (russia's head-coach) wishes cristiano's injury serious. (russia will play portugal tomorrow wcq) 
fabregas doesnt goto barcelona season dream switch alcantra starting seal position #epl 
facebook scam lady gaga's dead! - realbollywood.com news: london, aug 7: scam rounds .. 
fact hunter hayes carrie underwood going saturday going?? #what #notokay 
fact plans tomorrow night &amp; night fl minute &lt;&lt;&lt;&lt;&lt;&lt; 
fact will vote socialist fake liar president frightening bring america ruin! 
failed yet #bpos customer service - overnight work - guess microsoft? morning here. 
fail rams playing twice mnf fall-isn't enough?and 1st div game isnt wk9!un-frickin-real. 
fair, dear.. #truthbetold will taiwan 2, nov. tomorrow!! 
fake democrats lose wisconsin primary recalls fake democrats lost democrats supported party primaries tuesday 
false start penalty, garner moved early. brings 3rd 16 yale 47. 
family guy crap tonight. 
family member, friend, fan austin rivers want unfollow me. ugly. 
fan hit flush head harris english wayward drive 1st. lots blood #hadtohurt #shoutfore #players 
february 13th desperation day. 
february valentine's day, suave fuckers 
feel bad.. boo asia birthday event cancelled sunday!.. So forward 
, feel rugby world cup fever via 702, one? rugby friday? 
figured. suspect experiencing issues storm, maria. working it! ^dgm 
filming 'the butler' tomorrow. alan rickman!! -explanation- filming movie la 
find hard believe, viola davis troublemaker day. see.. 
finished 5th season army wives..now 
fireworks sale tomorrow. sorry, experiencing independence day states, nz fireworks impress all. 
fish tank &amp; guy named jeff carter. sadly, think dying. 
forget garlic, soup disgusting! thanks nothing, saturday kitchen. 
forgive farrackhan malcolm x thing. ninjas shit ninjas march..name thing.where the$ 
forgot sad episode 5th season dexter is. #depressing #dexter #darkpassenger 
fox chicago, angry. playing vikings vs redskins fucking clue championship rematch 49ers vs giants tomorrow?? 
francesco totti thinks roma will unable catch juventus &amp; wants #seriea side AOL instant messanger 3rd season 
frank gaffney insane. true hater. bigot pay, steve emerson. hate racket. 
fran paterno congenial media early years. age &amp; betrayal media rift media. 
fraud fears iebc turns poll kit: electoral commission wednesday will take measures e.. 
friday night knicks vs heat watching game fuck lbs engaged motherfucker #knicksnation #teammelo 
friday's cnet update playing republic : apple ceo ios 6 map mess apple ceo tim cook extremely sorr 
frustration kobayashi, perez india: reaction sauber, caterham, marussia hrt indian grand prix sunday. 
f-train messed today york carroll st..what's going mta?? together!! 
fuck halloween. fuck thanksgiving. fuck birthday. fuck christmas, year, valentines, st. patrick's, april fools. fuck that. 
fucking friday! bump friday flatbush zombies ignorant levels 
fuck it, reggie tomorrow .. 
fuck pack jett lounge friday off..u yeah 
fuck sat! at! :d 
fuck though, #sockersweek #chicagomagicpsg friday night lights olympic park 
fuck you, band covered friday night, fuck ricky martin existing place big jerk. 
'fuck you' super rugby ep kings relegated tomorrow. waiting 
fuming everton shambles, england cricket team cheer today #kenwrightout 
fyi. wednesday going suck caltrain, plan going work is. parade. 
gagner's agent talks continue, will hearing friday deal main stream media proved #clueless! 
game 1 2nd quarter knicks vs heat game.. poorest officiated game throughout entire playoffs bro. shaking head 
game sunday houston san fran coming up. focus beating tennessee. #jayisourqb 
gavin henson set rugby world cup dislocating bone wrist yesterday 
george zimmerman going win trial well plead guilty 
ghost rider 2's bad movie compared 1st. 
ghost rider 2: spirit vengeance, nonsense satisfy statham-quotient. 
ghost rider bullshit shaking head will red box tomorrow 
ghost rider monday. ignore it. 
ghost rider pretty shit.. 1st honesty 2nd badly directed.. shaky camera style disorientating 
ghost rider: spirit vengeance lost cause. 1st movie. decided dig hole.. 
ghost rider sucks compared 1st, mom ash told haha. 
giants 3rd-round pick failed drug test nfl combine: jayron holsey knew hurt bec.. #newyork #sports 
girl rhonda rousey bad. 6 ws way 6 1st arm bars. #badass 
girls front us sat played temple whole time, come? #confused 
glass rising, warmer here, lago del desierto, argentina 
god daft thing! (merlin) bright sometimes! (circe) sat washing paws, ignoring him! #girls 
God jacob :( cry tomorrow ? 
God mali music going philly tomorrow! liacouras center, performing kingsmen tour! sad. 
God music video tomorrow! way harry's voice :') 
god talking steelers tonight. playing. irrelevant tonight. 
God worst 10 days while. forward true blood cheer tonight. 
going bed episode family guy .. tired, && i'ma sleep stand thursday 
going bother watching eurosong tonight. tuesday. 
going brownsville tomorrow 
going duke game saturday. haha. duke. what'a joke are. 
going hit victor cruz classes cancelled tomorrow 
going lost cypress tomorrow 
